{
  "schema_version": "governor-decision/v1",
  "request_id": "req-20260312-sync-004",
  "stage": "spec_plan",
  "allow_query": false,
  "resolved_budget_class": "spec",
  "resolved_token_cap": 0,
  "max_capsules": 0,
  "max_deep_refs": 0,
  "flush_required": true,
  "must_compact_after": false,
  "cache_preferred": false,
  "warnings": [
    "pending flush before second capsule"
  ],
  "denial_reason_code": "pending_flush",
  "dedupe_key": "req-20260312-sync-004:spec:pending-flush",
  "compaction_target_tokens": null
}
